"At a distance of 10 km from Panjim Kadamba Bus Stand and 27 km from Vasco Da Gama Railway station, The Chapel of St. Francis Xavier is situated in Old Goa.

The Chapel of St. Xavier belongs to the Doric style architecturally. It is built of laterite blocks plastered with lime mortar. The tiled roof supported by wooden rafters and it is a plain chapel with only one altar. The Chapel was located within the College of St. Paul and was dedicated either to St. Anthony or to St. Jerome. As the Chapel was used by St. Francis Xavier, it was rededicated to him after his canonization in 1622. The original Chapel fell into ruins in 1570 and the present Chapel was rebuilt in 1884.

St. Francis Xavier the patron saint of Goa died in 1552 on his way to China. The body brought in 1554 to Goa and is kept in the Basilica of Bom Jesus. The sacred relic of St. Francis Xavier normally housed in a silver casket in the Bom Jesus church, is brought in a conventional emission by several priests to the Se cathedral every 10 years for philosophizing.

The Feast of St. Francis Xavier is celebrated annually on December 3rd in Goa to the memory of St. Francis Xavier. The feast commemorates the date the saint died and was buried. The feast is celebrated by all Goans throughout the state. Large scale festivities and fun events mark the feast, which is spread over a period of nine days and a wide array of food and drinks are available for people to enjoy. The atmosphere of Goa during the festival is truly dynamic, as thousands of people come together to pay their respects to the saint and enjoy the festivities.","https://firebasestorage.googleapis.com/v0/b/sih2020-cad27.appspot.com/o/francis.jpg?alt=media&token=898707dc-52f1-42cf-9add-c1bc7b798ca6","Panjim Old Goa","Chapel of St. Francis Xavier","0","Church","15.5008","73.9192","28"
"The Our Lady of the Immaculate Conception Church (Igreja de Nossa Senhora da Imaculada Conceição) is located in Panjim, Goa, India. The Church conducts Mass every day in English, Konkani, and Portuguese.
The colonial Portuguese Baroque style church was first built in 1541 as a chapel on a hill side overlooking the city of Panjim. It was eventually replaced by a larger church in the 1600s as part of Portuguese Goa's religious expansion.This church houses the ancient bell that was removed from the Augustinian ruins of the Church of Our Lady of Grace (Nossa Senhora da Graça) in the once famed city of Old Goa. This bell is considered to be the second largest of its kind in Goa, surpassed only by the Golden Bell which resides in the Sé Cathedral in Old Goa.","https://firebasestorage.googleapis.com/v0/b/sih2020-cad27.appspot.com/o/immaculate.jpg?alt=media&token=972a4af0-4c18-4d23-a41e-bf6a28e5b1ab","Panjim Old Goa","Our Lady Of The Immaculate Conception Church","0","Church","15.4987","73.8293","29"
"At a distance of 3 km from Panjim Kadamba Bus Stand, 24.5 km from Vasco Da Gama Railway Station and 16 km from Mapusa, Our Lady of Merces Church is situated in North Goa.

The Church of Nossa Senhora das Merces also known as Our Lady of Merces Church is located at Merces part of Panjim. It was originally a chapel in 1600 under Santa Cruz Church. It was established by the Dominicans and was elevated in 1613 after separating from Santa Cruz parish. It was further extended after the suppression of ancient parish of Santa Barbara in 1885.

The Church was built in a cruciform style and oriented in the east-west direction. The facade of the church resembles the Gothic style of church architecture. It has a peculiar design with 3 bays and 3 storeys. It has a templar Cross and an opening flank. The upper façade is framed by round ribbed columns and gothic pinnacles. One can see the image of a man symbolizing a dove which depicts the 3rd person of the Holy Trinity in this church.

The big bell is mounted on the apex. The front portion of the church is beautiful with a large entrance and two small doors on both sides. In front there is Christ the King statue in marble. We also find a grotto of Our Lady of Lourdes in the corner.

The Merces Saibinnichem Fest was celebrated each year on 2nd Sunday of November with great pump.","https://firebasestorage.googleapis.com/v0/b/sih2020-cad27.appspot.com/o/MERCES.jpg?alt=media&token=ec0e95cf-4ed1-4489-8204-a0a22b1421e3","North Goa","Our Lady of Merces Church ","0","Church","15.2787","73.9229","30"
"Situated just off the banks of Zuari River, 12 kilometers from
Margao in South Goa. In 1521 the Portuguese, in their 20 customary fashions first built
a church, then a prison, later in 1574-1610 a seminary to impart philosophy and
theology. It is in this seminary that the museum of Christian Art is housed. ","https://firebasestorage.googleapis.com/v0/b/sih2020-cad27.appspot.com/o/220px-Rachol_Seminary_-_Goa.jpg?alt=media&token=5a125344-a37e-4a1f-b183-ebead85e2ce8","Railtura, Salcete","Rachol Seminary","0","Church","15.3081","74.0053","31"
"28 km from Panaji in Pernem Taluka. The Temple, situated by the side
of the main road, is said to be more than 500 years old. Two life size images of
elephants in standing position made of black stone on either side at the entrance
welcome the visitors. TheGoddess Bhagwati Asthbhuja in a standing position on a high
pedestal is very imposing. Dussehra is celebrated with gaiety from Ashwin Shuddha Pratipada to Poornima, when over 25 thousand devotees assemble at the
temple.","https://firebasestorage.googleapis.com/v0/b/sih2020-cad27.appspot.com/o/bhagwati.jpg?alt=media&token=1a7da882-2ef8-43d1-aab8-40d2e406b278","Pernem Taluka","Shri Bhagwati Temple","0","Temple","15.7175","73.7969","32"
"Located in Bicholim Taluka at a distance of 45 km
from Anaji, the temple of Rudreshwar is half a km away from the rock-cut caves of
Harvalem where the ancient linga of Rudreshwar is venerated. The idyllic Harvalem
waterfall is close by. The image of Rudreshwar is facing the waterfall. The
festival of Mahashivratri draws big crowd. However, the temple assumes
importance as Hindus perform rites for the dead here. ","https://firebasestorage.googleapis.com/v0/b/sih2020-cad27.appspot.com/o/Rudra.jpg?alt=media&token=68d76d64-81e4-4b42-8514-ea4ca7c6cef0","Bicholim Taluka","Rudreshwar Temple at Harvalem","0","Temple","15.5504","74.026","33"
"Situated a distance of 25 km from Mapusa,
temple complex has beautiful natural surroundings. The three-day festival of 'Gades'
which begins on Phalgun Purnima draws big crowd. The devotees believe that
people can have the darshan of 'Devchars' during Gade Festival.","https://firebasestorage.googleapis.com/v0/b/sih2020-cad27.appspot.com/o/Bhumika.jpg?alt=media&token=bc9f5074-e20f-4c2f-8444-49ae3a578f47","Bicholim Taluka","Shri Mahadeo Bhumika ","0","Temple","15.6883","73.9234","34"
"Situated at Morjim in Pernem taluka this ancient
historical temple complex is situated amidst natural surroundings. The main
festival is ""Kalas Utsav"" which is celebrated once in every three, five, seven or nine
years. The duration of the festival is nearly a month beginning from Phalgun Shuddha
Panchami. The concluding seven days is a big religious and cultural affair when people
not only from Goa but also from Sindhudurga to Karwar assemble in large number.
Other festivals are Gudi Padwa, Dussehra, annual Zatra,""divzam"" and Ghodemodni. ","https://firebasestorage.googleapis.com/v0/b/sih2020-cad27.appspot.com/o/Morjai.jpg?alt=media&token=59d84364-260c-43f3-88cb-f72b406c4eac","Pernem Taluka","Morjaee Temple","0","Temple","15.6361","73.7399","35"
"7 kms from Valpoi, in the village of Brahma Carambolim. This
shrine belongs to the 5th century A.D. It is one of the few temples dedicated to Lord
Brahma found in India.","https://firebasestorage.googleapis.com/v0/b/sih2020-cad27.appspot.com/o/Brahmadev.jpg?alt=media&token=3e61d1a3-fb6b-4774-b6a5-5831f6efed52","Brahma Taluka Carambolim","Shri Brahmadev Devastan","0","Temple","15.5695","74.1626","36"
"45 km it is situated on the top of 350 meters high hill of Chandranath
Paroda, Quepem. Chandreshwar was the titular deity of Bhoja kings who ruled South
Goa before the Christian till the middle of 8th century. They had named their capital
Chandrapur after deity. Shivalinga is carved out from the rock, which oozes whenever
rays of full moon fall on it. The temple is so designed that Linga receives moonlight on
every full moon. The temple commands a panoramic view and its surroundings are
enchanting. The temple's ancient chariot is well known for its woodcarvings. ","https://firebasestorage.googleapis.com/v0/b/sih2020-cad27.appspot.com/o/Chand.jpg?alt=media&token=2f463767-6245-498a-9612-ba9a4e7591bf","Paroda","Shri Chandreshwar Bhootnath Temple","0","Temple","15.2339","74.0326","37"
"22 km from Margao at Zambaulim-Sanguem, situated in picturesque
surroundings on the banks of river Kushavati, popularly known as Panti. Near the
temple, the river is regarded particularly holy and is said to have medicinal properties.
The Hindus and Christians alike worship the deity. A weeklong celebration of Shigmo
is packed with programs, which include a colorful pair, exchange of gulal, collective
meals and presentation of shows on popular legends and folk culture. The deity was
originally in Margao.","https://firebasestorage.googleapis.com/v0/b/sih2020-cad27.appspot.com/o/Fatorda.jpg?alt=media&token=93d8901f-ac71-498f-ac98-4860b1ecfe26","Fatorda, Margao","Shree Damodar Temple","0","Temple","15.2339","73.9801","38"
"37 km at Dattawadi, Sanquelim, and 40 km from Margao. The
century old temple of trimurthy (Hindu) has a backdrop of a beautiful hillock covered
with dense groves of areca palms. The most important festival, which is attended by
devotees from all over Goa, is Datta Jayanti which falls in the month of December. The
deity is believed to have cured many people of unsound mind. The entire interior consists
of white marble.","https://firebasestorage.googleapis.com/v0/b/sih2020-cad27.appspot.com/o/dattareya.jpg?alt=media&token=36c7db3c-ebd6-4272-b84d-e5be48c243f9","Desai Nagar, Sanquelim","Shri Dattatreya Mandir","0","Temple","15.5659","74.007","39"
"26 km from Panaji at Farmagudi, Ponda, amidst beautiful
natural surroundings near Bandora. The Portuguese Viceroy attacked the fort of Ponda
in October, 1683 but had to beat a hasty retreat at the sudden appearance of the
Maratha King Sambhaji with a large army. Farmagudi commemorates this event. The
stone image of Gopal Ganapati was discovered by Herdsmen while grazing cattle near
the hill and later installed in a small shrine with a thatched roof. The temple built by
late Shri Dayanand Bandodkar, the first Chief Minister of Goa has the idol, made of
metal alloy, consecrated on April 24, 1966. It is a good specimen of Indian temple
architecture synthesizing both ancient and modern. ","https://firebasestorage.googleapis.com/v0/b/sih2020-cad27.appspot.com/o/Gopal.JPG?alt=media&token=c07b7e47-3c87-4041-b49c-20cdb8f8ef08","Ponda - Panaji Rd, Donshiwado, Ponda","Shree Gopal Ganpati Mandir","0","Temple","15.4126","73.9876","40"
"66 km from Panaji in Sanguem Taluka at
the foot of the Ghats, is the only specimen of Kadamba-Yadava architecture (14th
century) in basalt stone preserved and available in Goa. A memorable road connects
Sancordem to this temple complex.","https://firebasestorage.googleapis.com/v0/b/sih2020-cad27.appspot.com/o/Tambid.jpg?alt=media&token=dc970f8f-b3e4-4104-8628-40f76eb59d65","Near Bhagwan Mahaveer Wildlife Sanctury, Sanguem","Mahadeva Temple, Tambdi Surla","0","Temple","15.4391","74.2526","42"
"14 km from Mapusa at Kansarpal. It is said to be about hundred years
old. Divided into two outer halls, supported with seven rows of four pillars, has a
stage to perform dramas on festive occasion. The inner shrine contains the revered
image of the Goddess, 'Kali' a fierce form of Devi. Agrashalas (rest house)
surrounding the temple provide facilities for lodging to the devotees.","https://firebasestorage.googleapis.com/v0/b/sih2020-cad27.appspot.com/o/Kalika.jpg?alt=media&token=0f2bc72e-ce07-435b-8da3-961846e38d4a","Kasarpal Bicholim, Latambarcem","Mahamaya Kalika Devasthan","0","Temple","15.6492","73.9349","41"
"Situated in the village of Bandode, about 4 km from Ponda, it is
considered the abode of the original Goddess of the Shakti cult. The Sabhamandap has
a gallery of 18 images, out of 24 images of emanatory aspects of Bhagvata sect, which
is considered one of the few galleries of wooden images of Vishnu in India. The
image of Mahalakshmi has a close resemblance to that of Mahalakshmi at Kolhapur, the main centre of worship, Her special feature is that she wears a linga on her head and is
considered a peaceful or Satvik form of the Devi.","https://firebasestorage.googleapis.com/v0/b/sih2020-cad27.appspot.com/o/Bandora.jpg?alt=media&token=ae4dec4c-0fd4-41ca-8147-d4d77314106a","Bandora, Ponda,","Shree Mahalaxmi Saunsthan, Bandora","0","Temple","15.406","73.9798","43"
"At Mardol, 1 km from Shri Manguesh temple. The deity worshipped is
an attribute of Vishnu (Mohini during the fight between Devas and Asuras) Main
festivals: Zatra and Navaratra. ","https://firebasestorage.googleapis.com/v0/b/sih2020-cad27.appspot.com/o/Mahalsa.jpg?alt=media&token=4b063e05-15e2-4e47-9e6f-bb4caba285da","Mardol,Ponda","Shri Mahalasa Narayani Mandir","0","Temple","15.4405","73.9727","44"
"40 km from Margao at Canacona, the southernmost Taluka of Goa, is
believed to have been constructed during the middle of 16th century by ancestors of the
Kshatriya Samaj. It was renovated in the year 1778. The temple has massive wooden
pillars with intricate carvings. There are 60 deities around the temple. Rathasaptami
has festivals in Feb. where as Shigmotsav has in April, which draw large crowd. ","https://firebasestorage.googleapis.com/v0/b/sih2020-cad27.appspot.com/o/Mallika.jpg?alt=media&token=85bd3d25-f58c-456a-afe4-1f5bd242b936","Canacona","Shri Mallikarjuna Temple","0","Temple","15.0227","74.0764","45"
" 22 km from Panaji (26 km from Margao) at Priol- Ponda Taluka. It is
located on a hillock surrounded by lush green hills. Though small, it has an air of
distinctive elegance. Its lofty white tower at the entrance is a landmark of the
countryside. This is a temple dedicated to Lord Shiva. ","https://firebasestorage.googleapis.com/v0/b/sih2020-cad27.appspot.com/o/Mangesh.jpg?alt=media&token=cd095931-93d1-4b8c-8bcd-c8af21ecf4fe","Mangeshi Village, Mardol","Shree Mangesh temple","0","Temple","15.4449","73.9664","46"
"Dedicated to Lord Shiva, is situated in the village of Bandode, about 4
km to the east of Ponda. The temple Sabhamandap has a gallery on both sides that
contains exquisite specimen of intricate woodcarvings of the events of Ramayana on
one side and wooden images of Astadikpal and Gandharva on the other. ","https://firebasestorage.googleapis.com/v0/b/sih2020-cad27.appspot.com/o/Nagesh.jpg?alt=media&token=a90d8612-fa20-472f-8bf2-1f70a2ddd326","Bandiwade, Donshiwado, Ponda","Shree Nagesh Maharudra Mandir","0","Temple","15.4075","73.9837","47"
" 34 km from Panaji at Borim (12 km from Margao) The deity
of Goddess Navdurga was originally brought by Brahmins of Karad to Goa. The deity
was later transferred from Benaulim in Salcette to its present site at Borim.","https://firebasestorage.googleapis.com/v0/b/sih2020-cad27.appspot.com/o/Borim.jpg?alt=media&token=11eb9cb2-b4b2-4627-8b78-834d90c969a7","Borim","Navadurga Temple","0","Temple","15.3662","74.0111","48"
"33 km from Panaji in Ponda Taluka. Besides the shrine of the main
Ramnath deity, it has four small temples of Shri Laxminarayan, Shri Shantadurga
(Sateri), Shri Betal and Shri Sidhanath. The five together, constitute Shri Ramnath
Panchayatan. The legend in mythology says that Rameshwar is the original abode of
Lord Ramnath. ","https://firebasestorage.googleapis.com/v0/b/sih2020-cad27.appspot.com/o/Ramnath.jpg?alt=media&token=063d3b01-d523-4aac-83ba-4db0b842b4f4","Ramnathim, Ponda","Shree Ramnath Mandir","0","Temple","15.3988","73.9808","49"
"37 km from Panaji at Narve-Bicholim, was a favored deity of
Kadamba Kings. Its original temple was situated in the island of Diwar. The
Portuguese destroyed it and the idol was shifted to its present site at Narve (Bicholim),
Many years afterwards in 1668 A.D. Chhatrapati Shivaji ordered renovation of this temple
at the present site during one of its campaigns to oust the Portuguese. The linga
worshipped in this temple is faceted and is known as 'Dharalinga'. ","https://firebasestorage.googleapis.com/v0/b/sih2020-cad27.appspot.com/o/Bicholim.jpg?alt=media&token=6878c5ed-0031-49e9-ae7b-9206e1059366","Temple Road, Narve, Maem","Shree Saptakoteshwar Temple","0","Temple","15.5542","73.9371","50"
"Situated 17 km from Mapusa in Pernem
Taluka, the complex has five temples, main temples being of Shri Septeshwar and
Bhagavati. Other temples are Narayan, Ravalnath and Satpurush. Dassehra, Zatra,
Bhajani Saptah are the main festivals. The temples were renovated some years ago","https://firebasestorage.googleapis.com/v0/b/sih2020-cad27.appspot.com/o/Bhagwatii.jpg?alt=media&token=7bbc2d07-18e3-4517-b5a9-948afd62794e","Devulwada,, Mandrem","Sapteshwar Bhagvati Temple","0","Temple","15.6616","73.7359","51"
" Vitthal Maharudra Panchayatan rudra the complex comprise of
temples of Jagrut Swayambhu Goddess Sharvani, Mahadev and Vetal with his life size
image of stone and other deities. It is situated in scenic surroundings at Advolpal in
North Goa, 24 km from Assonora on Pirna main road. Goddess is known for fulfilling
the vows of her devotees through Kaul Prasad who also perform Tulbhar to propitiate
her. Thousands of devotees throng on vardhapan day, Divja zatra day and annual zatra
day in November/December when procession of Goddess is taken out in decorated
chariot. ","https://firebasestorage.googleapis.com/v0/b/sih2020-cad27.appspot.com/o/advol.jpg?alt=media&token=44875e5d-164f-4c56-9993-75a922cd6bd1","Advalpale","Sharvani Devi Temple","0","Temple","15.6384","73.9028","52"
"Built in the 1st century, the Jama
Masjid was completely renovated in 1959. The new structure is remarkable for its
harmonious proportions and elegant simplicity. It has four minarets at the entrance
facade is flanked by two elegant turrets surmounted by pillared kiosks. A Dom-shaped
kiosk rises in the centre of the four minarets. Festivals are celebrated here
with due solemnity. ","https://firebasestorage.googleapis.com/v0/b/sih2020-cad27.appspot.com/o/Jama.jpg?alt=media&token=7cfd535c-d504-4a67-9dd1-bc131828eb63","Sanguem Rd, Muslimwada, Sanguem","Jama Masjid","0","Mosque","15.229","74.1498","53"
"The Safa Shahouri Masjid, the biggest and
most famous of the 27 mosques in Ponda taluka was build in 1560 by
Ibrahim Adilshah of Bijapur.Adjacent to the mosque is a well-constructed masonry
tank with small chambers with 'Meharab' designs. The mosque and the tank were
formerly surrounded by an extensive garden with many fountains. They were all destroyed during the Portuguese rule. The two major festivals Id Ul-Fitr and Il-UdZuha are celebrated at this mosque with great pomp and are attended by a large
number of people. ","https://firebasestorage.googleapis.com/v0/b/sih2020-cad27.appspot.com/o/Safa.jpg?alt=media&token=adca5298-04e3-46e1-a18f-42fd0ebb9f7c","Shapur, Ponda","Safa Masjid","0","Mosque","15.4066","74","54"
"Situated along the North-East border of
Goa at Molem, about one and a half hours journey from Panaji along Panaji - Belgaum
National Highway, the Bhagwan Mahavir Wildlife Sanctuary covers about 240 sq km of
thick forest clad slopes of western ghats and is the biggest of the three sanctuaries of Goa.
The sanctuary is rich in wildlife. It is a paradise for bird watchers.
Besides flora and fauna there are many important geological and historical feature
in this sanctuary. Dudhsagar falls, about an hour's journey from Colem by train, is a
feast for the eyes. ""Devil's Canyon"" is another beautiful geological spot. The famous
Tambdi Surta temple is about 13 km from Molem. The Directorate of Tourism
has built comfortable cottages and dormitories for tourists. Entry fee is Rs. 10/- per
adult, Rs. 5/- per child and Rs. 3/- per student. ","https://firebasestorage.googleapis.com/v0/b/sih2020-cad27.appspot.com/o/Bhagwn.jpg?alt=media&token=24637101-d440-44ac-aabb-8c713b36efac","South Goa","Bhagwan Mahavir Wildlife Sanctuary","0","Wildlife Sanctuary","15.3339","74.2884","55"
"The second largest of the three wildlife sanctuaries in Goa,
with an area of 105 sq km is located at about 60 km from Panaji, in Canacona taluka in
South Goa, nearly 3 km off the Panaji - Mangalore National Highway No. -17. It is
covered with dense forest and varied wildlife, fauna and reptiles. The ancient Jeevottam
Partagal Math, noted for Vedic studies, lies in the vicinity of the sanctuary.","https://firebasestorage.googleapis.com/v0/b/sih2020-cad27.appspot.com/o/Cotiago.jpg?alt=media&token=24f9d816-248b-49b9-90fe-5599ed0b80a9","Canacona Taluka, Khotigao, Goa 403702","Cotigao Wildlife Sanctuary","0","Wildlife Sanctuary","14.976","74.2062","56"
"Spread over 1.78 sq km and located at the western tip of the
island of Chorao along river Mandovi near Panaji, it is fully covered with mangrove
species. Varieties of local as well as migratory birds frequently visit this sanctuary. This
sanctuary can be visited any time of the year with the permission of the Chief Wild Life
Warden. Forest Department, Junta House, Panaji-Goa. The sanctuary is approachable by
walk after crossing over by ferry from Ribandar to Chorao. There are some private parties
who can take tourists around in their canoes fitted with outboard motors. ","https://firebasestorage.googleapis.com/v0/b/sih2020-cad27.appspot.com/o/Ali.jpg?alt=media&token=1eebb3b3-30c0-4313-93c1-0b9e20c59787","Chorao Island, Ilhas, Ribandar","Dr. Salim Ali Bird Sanctuary","0","Wildlife Sanctuary","15.513","73.8704","57"
"With immense Heritage potential for tourists, belongs to Mrs. Sara
Fernandes, situated at Cotta in Chandor. Casa Araujo Alvares heritage home at Loutolim
belonging to late Adv. Eufermiano Araujo Alvares is 250 years old. Visiting hours :
9.00 a.m. 6.00 p.m. ","https://firebasestorage.googleapis.com/v0/b/sih2020-cad27.appspot.com/o/Heritage.jpg?alt=media&token=5c7e81b9-f703-408c-b9fd-158e87aa2fa3","Fort Area Salcette, Cotta Diasvaddo, Chandor","Fernandes Heritage House","0","Heritage House","15.2558","74.0519","58"
"The beautiful Kesarval falls have a lot more going for them than the magnificence and awe of just another waterfall. These falls, sometimes also known as Kesarval Springs are renowned for their medicinal properties. The waters are purported to heal ailments of the body and to have rejuvenating properties.

The minerals in the water come from the hard rock face that it pounds through. The springs are accounted to be a great natural spa.","https://firebasestorage.googleapis.com/v0/b/sih2020-cad27.appspot.com/o/Kesarval.jpg?alt=media&token=cc091110-64f1-4f4c-bcc5-fd4bf222aea6","Quelossim","Kesarval Spring Verna Waterfall","0","Waterfall","15.3823","73.9288","59"
"Set amidst the picturesque surroundings of a sleepy Goan village, the Mayem Lake is a popular tourist picnic in North Goa. Even the journey to reach the lake is a beautiful one on a winding Goan road through the thickets of cashew trees, areca nut trees and pineapple plantations.

The region around the lake is hilly, and the slopes are covered with forests and wild cashews. Around the lake are vendors selling trinkets and snacks most notably coconuts and coconut water.","https://firebasestorage.googleapis.com/v0/b/sih2020-cad27.appspot.com/o/Banner-mayem-lake.jpg?alt=media&token=da4a2ce2-4202-456b-a9db-f6a3fb41748b","Maem,Bicholim Taluka","Mayem Lake","0","Lake","15.576","73.94","60"
"1.Cabo de Rama Beach (1.3 kms) can also be visited from this place.2.Canaguinim Beach (8 kms) can also be visited from this place.3.Agonda Beach (14.4 kms) can also be visited from this place.4. Cola Beach (14 kms) can also be visited from this place.","https://firebasestorage.googleapis.com/v0/b/sih2020-cad27.appspot.com/o/Cabode.jpg?alt=media&token=ab89c8fa-bbda-4298-9b90-24f21abc1af4","Taluka Cabo da Rama, Canacona","Cabo De Rama Fort ","0","Fort","15.088","73.9199","61"
"1.Hansa Beach (6 kms) can also be visited from this place.2.Bogmalo Beach (12.8 kms) can also be visited from this place.3.St. Andrew's Church (4.7 kms) can also be visited from this place.","https://firebasestorage.googleapis.com/v0/b/sih2020-cad27.appspot.com/o/Mormugao.jpg?alt=media&token=f41d2e3b-3590-4b72-8354-16d51f5f3ccd","Mormugao taluka","Mormugao Fort ","0","Fort","15.3999","73.7913","62"
"1. Cabo De Rama Fort (14.4 Kms) can also be visited from this Beach.2. Cola Beach (3.4 kms) can also be visited from this Beach.3. Agonda beach is not the ideal place for swimming.4. Palolem Beach (8.7 kms) can also be visited from this Beach.","https://firebasestorage.googleapis.com/v0/b/sih2020-cad27.appspot.com/o/AgondaB.jpg?alt=media&token=0be51922-1539-4387-8fc1-93641c3ced6a","Agonda Village","Agonda Beach ","0","Beach","15.0456","73.9889","63"
"1. Kalacha Beach (1 km) can also be visited from this Beach.2. Ashwem Beach (6 kms) can also be visited from this Beach.3. Our Lady of Mount Carmal Church (15 kms) can also be visited from this Beach.4.Mandrem Beach (6 kms) can also be visited from this Beach.","https://firebasestorage.googleapis.com/v0/b/sih2020-cad27.appspot.com/o/Arambol.jpg?alt=media&token=9ab25be1-ac14-41ac-8f10-fcb1122ae8a3","Arambol Village","Arambol Beach / Harmal Beach ","0","Beach","15.6847","73.7033","64"
