"Baga Beach is the most famous of all Goan beaches and as a tourist visiting Goa you really haven’t been to Goa if you haven’t been to Baga. Full to the brim with activities you can indulge in, Baga Beach and its surrounding areas will not give you time to get bored. There is always something exciting going on here. ","https://firebasestorage.googleapis.com/v0/b/sih2020-cad27.appspot.com/o/pic1.jpg?alt=media&token=267a9d96-b7cc-43b5-b504-1717330de145","Baga","Baga Beach","0","Beach","15.5553","73.7517","1"
"The largest beach in Goa, Calangute Beach is also affectionately known as the “Queen of Beaches”. It is among the top ten beaches in the world, which means it is one of the tourist places in Goa that you should not miss. It is a big, serene beach with activities enough to fill your mind for the entirety of your trip. The beach alone is a great attraction for tourists. The beach is ideal for both the options,  lying down in the sand without the fear of being run over or trying your hand at some water sports.  There are a lot of options to choose from. The distance of Calangute from Baga Beach is not great; the two beaches are only separated from each other by some rocks. You can choose to have breakfast or lunch at Baga or Calangute. There are also many great sight-seeing opportunities near Calangute such as Morjim Beach, St. Alex Church, the Water Pond of Arambol, Ashvem Beach, the Aguada Lighthouse & Aguada Fort, Nerul River, the Friday Local Mapusa Market, River Betul & Betul Estuary","https://firebasestorage.googleapis.com/v0/b/sih2020-cad27.appspot.com/o/pic2.jpg?alt=media&token=6f3e4562-fbb3-4d87-a102-a0c2e6ab1084","Calangute, North Goa","Calangute Beach","0","Beach","15.5494","73.7535","2"
"""There is no dearth of water related activities in Goa, of course. But while the different beaches up and down Goa offer tourists many options, these options are not to be found all in one place. Not so in grand island. Grand Island is the nirvana of Goan water-sports. There is a lot to be experienced here from diving to snorkelling to fishing. Scuba diving in Goa is the most popular activity because it offers so much in terms of underwater exploration.  There are ship wrecks to be found here as well as some reefs. The “Suzy” wreck and the “Davy Jones Locker” are especially popular with divers as are Serge City, Bounty Rock, and Turbo Tunnel. Experienced and beginner divers both find something to satisfy in Grand Island. You can also go snorkelling.","https://firebasestorage.googleapis.com/v0/b/sih2020-cad27.appspot.com/o/pic5.jpg?alt=media&token=c8c67a39-417d-4777-96ad-4b79ea258b69","Grand Island, South Goa","Illha Grand","0","Island","15.3527","73.7779","3"
"The Dudhsagar Waterfalls are situated on the Goa-Karnataka border and are one of India’s must-see sights. The four-tiered waterfall structure is one of the tallest in India and is located on the Mandovi River. The white water cascades down from a height of nearly 1017 feet off a nearly steep mountain face. They form a part of the Bhagwan Mahaveer Sanctuary and Mollem National Park, so the best way to reach them is by entering the national park and taking a van allocated by the park to the falls.  The Dudhsagar trek inside the park is closed to the public but you can still reach the waterfalls by trekking from Kulem and following the jeep trail. Another possible route is the trek from Castle Rock in Karnataka. Reaching the waterfalls will not be an easy task but it is one that is worth every ounce of effort put into it.  They are best experienced during the monsoons as they lose their force during the dry season.  Many tours are organized over this time so you can choose to go as a part","https://firebasestorage.googleapis.com/v0/b/sih2020-cad27.appspot.com/o/pic6.jpg?alt=media&token=0d71265d-ad00-4c07-878c-65b232acfba3","Sanguem Taluka","DudhSagar WaterFalls","0","Waterfall","15.3144","74.3143","4"
"Another heritage from the Portuguese, Fort Aguada has been standing stern on the beach facing the Arabian Sea from 1612 when it was built in order to provide defence against the invading Dutch and the Marathas. It was a grand old fort in its time with the capacity to hold 79 cannons among other weapons of defense. It was one of the prized possessions of the Portuguese. Today, it stands as a famous landmark dividing the Sinquerium Beach and the Candolim Beach.  There is an old lighthouse standing within the fort which was built in 1864, the oldest lighthouse of its shape and size in India. Fort Aguada is a great place to explore when you are out visiting the Candolim or Sinquerium Beaches. The architecture gives a good insight into the building techniques of old Portuguese architects and it has some amazing views you should really see. The old fort provides a good view of the sea and the sunset is reckoned to be lovely.","https://firebasestorage.googleapis.com/v0/b/sih2020-cad27.appspot.com/o/%5Dpic7.jpg?alt=media&token=8f704b88-7633-4c98-b14d-26d133ed913e","Candolim , North Goa","Aguada Fort","0","Fort","15.4926","73.7732","5"
"Running from Calangute Beach on one side to Fort Aguada on the other is the Candolim Beach. The day activities offered on this beach are its best attraction. You can perform a whole host of activities on the beach including a vast array of water sports, all at very reasonable prices. You can choose to spend some time at Candolim Beach and then head over to Calangute next door or just spend all your day on this beach and explore the sights nearby.  Renting a scooter in order to get around freely is the best option and will only cost around Rs.300/- for the day. Many churches and chapels dot its neighbourhood and there is also an old lighthouse which stands inside Fort Aguada. The Fort Aguada Jail is also a tourist attraction. The best part about Candolim Beach is that it has significantly lesser footfall.","https://firebasestorage.googleapis.com/v0/b/sih2020-cad27.appspot.com/o/pic8.png?alt=media&token=84b31d83-cb6a-44f7-a5f6-1d615167ed5d","Candolim, North Goa","Candolim Beach","0","Beach","15.5116","73.772","6"
"Goa is India’s favourite party place. Therefore, you simply have to visit one of the many clubs scattered around Goa on your visit there. Tito’s Street is one of the best clubs you can visit. Tito’s Street, named after the street it is located on, is a club that attracts a lot of crowd especially because of its prime location and its top-notch service. Baga beach, where the club is located, is a party hub so it is no wonder that loads of tourists find their way to Tito’s Street after sundown.  The club is known for its excellent services and this compensates amply for the slightly overpriced tags on drinks and food. The place is made up of two levels: the lower level is a dance floor with a separate dance space for couples; the upper level allows people to sit and watch the activity below while enjoying their food and drinks. The DJ is reckoned to be very good and you’re sure to get in some soul-pumping dancing on your visit.","https://firebasestorage.googleapis.com/v0/b/sih2020-cad27.appspot.com/o/pic9.jpg?alt=media&token=9c228c7e-5a9c-484e-b6e2-6c25cc7daefa","Tito’s Street, Baga Beach, North Goa","Tito's Street","0","Club","15.5565","73.754","7"
"Housing the miraculous statue of Mae de Deus (Mother of God) which was brought from the ruins of the convent of Mae de Deus at Old Goa, this church in Saligao stands as one of the finest examples of the neo-gothic style of architecture. The church is situated in the amazing surroundings of the typical Goan countryside giving it the look of a castle from a fairy tale. The church was built in the year 1873. The first Sunday of May is celebrated as the church feast, the feast of Our Lady, the Mother of God which is the best time to join the celebrations. Claiming its fame with the miraculous Mae de Deus statue of Old Goa, The Mae de Deus church has a glamorous charm of its own which draws a lot of tourists from all over the world. Looking like a princess castle with its gothic spires and pristine white walls, the church mesmerizes all with its magnificent dome-shaped exteriors as well as its carved interiors. Its proximity from Calangute Beach makes it popular amongst locals and tourists ","https://firebasestorage.googleapis.com/v0/b/sih2020-cad27.appspot.com/o/pic10.png?alt=media&token=2e593c9d-97aa-4477-b84b-d5dfbbf8d5e5","Saligao","Mae De Deus Church","0","Church","15.547","73.7854","8"
"One of the most important of all tourist places in Goa as well as a central landmark for Catholics, the Bom Jesus Basilica is the place in which the incorrupt body of St Francis Xavier is kept. The Church was built in 1605 and the body of the Saint was brought to it in 1622 where it has laid since in its glass mausoleum. The body is perhaps the greatest attraction of the Basilica. A gallery of Modern Art is also a part of the Basilica.  The building is constructed in baroque style and is considered one of the best examples of baroque architecture in India. You can visit the Bom Jesus Basillica in December for the best experience of the tradition as the feast and novena take place at that time along with Christmas celebrations.","https://firebasestorage.googleapis.com/v0/b/sih2020-cad27.appspot.com/o/pic111.jpg?alt=media&token=49913d92-b7be-483e-b912-07879d43c387","Old Goa","Bom Jesus Basilica","0","Church","15.5009","73.9116","9"
"From the village of St. Estevam, the fort of Jua can be approached by means of a fairly formidable flight of rough steps. The view from the fort at Sant Estevam is actually scenic looking down towards the iron ore mines and loaded barges moving towards Mormugao. Originally, the fort was believed to serve as an outpost to protect Ilhas from Muslim invasions.It has been quoted that here lies the remains of a fort with beautiful hill view which is perfect for sunsets.","https://firebasestorage.googleapis.com/v0/b/sih2020-cad27.appspot.com/o/Historical-Places-in-Goa-fort-of-st.estevam.jpg?alt=media&token=4ba3ff96-7159-45f1-bab3-5e1c4ae254cc","St Estevam Island","Fort of St Estevam","0","Fort","15.536","73.9542","10"
"If you are on the lookout for some revitalising beach holiday destinations in North Goa, the Vagator beach is just the place for you. The northernmost beach of Bardez Taluka, the Vagator beach is 21 kilometres from Panaji and is characterised by a combination of its soft white sands and imposing but beautiful rocky cliffs. The beach is divided into two major parts, namely Little Vagator, also known as Ozran Beach, and Big Vagator. While the sweeping view of the sea from the Vagator cliff is undoubtedly stunning, tourists also flock to Vagator for its myriad dining options and an overall upbeat vibe at the beach shacks and parties.

Vagator has recently gained a place of preference in the hearts of tourists and travellers for its cuisine culture. One of the most famous places to be at is, of course, Thalassa - a quaint and artistic greek themed beach restaurant with beach seating and stunning gourmet adventures. Moreover, there are various other gourmet places serving up some quality ","https://firebasestorage.googleapis.com/v0/b/sih2020-cad27.appspot.com/o/Vagator-Beach.jpg.webp?alt=media&token=464443d0-cb3d-4432-94ae-87c05744c452","Bardez Taluka,Goa","Vagator Beach","0","Beach","15.6029","73.7336","11"
"The stunning 400-year-old Shri Mangesh temple is dedicated to Lord Shiva and is outstanding with its simple and elegant structure. It is considered to be the most beautiful among the temples in Goa and among the most important places to visit in Goa. A wonderful seven-storeyed lamp tower or deepstambha stands in the temple complex. The temple also has a beautiful water body, which many believe is the oldest part of the temple.
The Sabha Griha is an assembly hall which can accommodate over 500 devotees. The decor includes the chandeliers of the nineteenth century. The central part of the Sabha Griha leads to the Garbha Griha where the image of Mangesh is consecrated.
Shri Mangeshi temple is located at Mangeshi Village in Priol, Ponda taluk, Goa. It is at a distance of 1 Km from Mardol close to Nagueshi, 22 Km from Panaji the capital of Goa and 26 Km from Margao.
This temple is one of the largest, most enchanting, serene and most frequently visited temples in Goa. The temple has recen","https://firebasestorage.googleapis.com/v0/b/sih2020-cad27.appspot.com/o/shri-mangeshi-temple-shri-mangueshi-temple-goa-entry-fee-timings-holidays-reviews-header.jpg?alt=media&token=9c987a72-24cf-4269-b67d-ce646937f8ec","Ponda Taluk, Goa","Shri Mangeshi Temple","0","Temple","15.4466","73.9701","12"
"Colva Beach
Located 6 km away from the west of Margao, Colva beach is one of the largest and striking beaches of South Goa that has fine powdered white sand and bounded by coconut palms that elongate from Bogmalo to Cabo de Rama alongside the coastline of south Goa. The Colva beach is very beautiful and has a stream flowing through it. Speckled with colonial style villas and broken-down fishing huts, the beach looks more stunning with a wide collection of concrete hotels, souvenir stalls and snack bars all around it. During day time, many tourists in colorful attires throng at this place and some are also seen sunbathing in the bright sun. On the other side, drink stands and jewelry stalls on the golden sands make a moony evening on the Beach of Colva very romantic for honeymoon couples.

There are lots of shacks available for lunch and a cold beer or two. For adventure freaks, various kinds of water activities are also available on the beach. While taking a long walk on the Colva B","https://firebasestorage.googleapis.com/v0/b/sih2020-cad27.appspot.com/o/Colva.jpg?alt=media&token=33827db2-14b5-4667-9d51-5f33ed1d362d","South Goa","Colva Beach","0","Beach","15.2805","73.912","13"
"Standing tall and proud overseeing and protecting the taluka of Bardez, across the river from the capital city of Panaji, this fort was one of the first bastions of the Portuguese rulers against enemy invasion. The structure exudes majesty and grandeur and though it is not the biggest fort in Goa, it still commands respect and awe.

Pre-dating even the prestigious and much larger Fort Aguada, and situated at the narrowest point of the mouth of the Mandovi, it’s skilful construction and strategic placement made this fort nearly impregnable and it was an important asset to the Portuguese colonists.

The fort has also been skilfully repaired in recent years and partly restored to its former glory. It is clearly visible, with its distinctive reddish stone walls, all the way from Panaji which lies across the Mandovi River from it.","https://firebasestorage.googleapis.com/v0/b/sih2020-cad27.appspot.com/o/Reis-min.jpg.webp?alt=media&token=1a444eea-cc50-403b-a59d-bae56868686d","Verem, Bardez, Goa","Reis Magos Fort","0","Fort","15.4971","73.8095","14"
"Popularly known as the freak capital of the world, Anjuna is just the right place for lazing holidaymakers. Besides the calm waters of the Arabian Sea lapping softly on the Indian shore, Anjuna comes live with its ever-famous full-moon parties and the Wednesday flea market to take one on to a trance trip. Anjuna is a small village in north Goa, on the shores of the Arabian Sea. It lies 18 km away from Panaji (the old name for Panjim), the capital of Goa.The key attractions of Anjuna Beach are the magnificent Albuquerque Mansion built in 1920 (flanked by octagonal towers and an attractive Mangalore tile-roof), the Mascarenhas Mansion, and the Chapora Fort. 

Wednesday Flea Market - Every Wednesday, at around 11 a.m., Anjuna breaks into a riot of colors. Lines of vehicles full of tourists start virtually raising clouds of dust in this area. Whatever one needs, from a used paperback to a haircut, one would find it here. The flea market is a heaven for hardcore shoppers and good bargaine","https://firebasestorage.googleapis.com/v0/b/sih2020-cad27.appspot.com/o/pic1.jpg?alt=media&token=267a9d96-b7cc-43b5-b504-1717330de145","Bardez Taluka","Anjuna Beach","0","Beach","15.5733","73.741","15"
"This is yet another popular destination for tourists and is especially a favourite evening haunt for people to chill out. The fort overlooks the Chapora river and hence its name. However, there is a more interesting name given to this fort i.e. ‘Dil Chahta Hai’ Fort. The name literally translates to ‘the heart yearns’ and the reason for this quirky name is that a Bollywood film with this title (Dil Chahta Hai) was shot back here in 2001. When the movie became a blockbuster, a sweeping hit, striking a chord with the young generation, people started indentifying this fort with the name of the movie only.

As highlighted earlier, the best time to visit Chapora Fort is evening time because sunset sky looks spectacular from here. Moreover, when the sky paints everything around, especially the Chapora River and beaches of Chapora, in its sunset colour, ah! the sight is just out of this world.","https://firebasestorage.googleapis.com/v0/b/sih2020-cad27.appspot.com/o/Chapora_Fort_Attractions.jpg?alt=media&token=33b8102b-0727-4a2d-a93e-22726fc0a849","Bardez Taluka","Chapora Fort","0","Fort","15.606","73.7363","16"
"Shri Shantadurga Temple is situated at the foothill of Kavalem village in Ponda Taluka, Goa. A small laterite mud shrine was built and the deity was installed here. The mud-shrine was converted into a beautiful temple whose foundation stone was laid in 1730 and the temple was completed in 1738 and renovated in 1966

The temple is dedicated to Shantadurga, the goddess who mediates between Vishnu and Shiva. The deity is also called 'Santeri' colloquially. Local legends tell of a battle between Shiva and Vishnu. The battle was so fierce that the god Brahma prayed to Goddess Parvati to intervene, which she did in the form of Shantadurga. Shantadurga placed Vishnu on her right hand and Shiva on her left hand and settled the fight.

Shantadurga is shown as holding two serpents, one in each hand, representing Vishnu and Shiva

The original temple at Quelossim (Keloshi) in Salsete was destroyed by the Portuguese in 1564. The goddess was transferred to Kavalem and worship was continued th","https://firebasestorage.googleapis.com/v0/b/sih2020-cad27.appspot.com/o/shree-shantadurga-temple.jpg?alt=media&token=55f618d9-1299-4fa9-83ad-4b277bda42a9","Kavlem,Phonda","Shri Shantadurga Temple","0","Temple","15.3958","73.9678","17"
"It’s an iconic structure that is visible to all that approach Goa’s former capital of Old Goa from the old Ponte Conde de Linhares route. Tourists visit it all year round without knowing anything about it. This edifice that is now in a state of ruins has also been reproduced thousands of time on postcards and travel brochures. And it just happens to be a UNESCO World Heritage site too. We’re talking about the world-famous ruins of St Augustine Tower and Church complex in Old Goa.
St Augustine Tower and Church complex ruins stand high up on the Monte Santo (Holy Hill) at Velha Goa (Old Goa). Built by the Augustinian friars who arrived in Goa in 1587, it was also the then site of the enormous church of Nossa Senhora da Graça (Our Lady of Grace). The Tower and the Church were built in 1602. Nossa Senhora da Graça, on its completion, was recognized as one of three great Augustinian churches in the Iberian world, the other two being the Basilica of the Escorial in Spain, St. Vincente de Fo","https://firebasestorage.googleapis.com/v0/b/sih2020-cad27.appspot.com/o/Augustine.jpg?alt=media&token=c90c827d-b1d8-489a-a45f-ac60cf6621c2","Velha Goa(Old Goa)","St. Augustine Tower/ Church of St. Augustine","0","Church","15.5005","73.9065","18"
"The village of Bandode or Bandivade is the location of a number of temples among which is the large and beautiful temple of Goddess Mahalaxmi.

The temple of Goddess Mahalaxmi has been in existence since at least the year 1413, when information about the rituals of the temple is found on stone plaques carved during the reign of Nanjan Gosavi Pratihast over Goa.

However, there was another temple of Mahalaxmi in the fifteenth century in the town of Colva in Salcette. As is the case with most Hindu deities in Goa, the idol of Mahalaxmi from this temple was also smuggled away in the middle of the night to avoid persecution by the Portuguese in the sixteenth century.

Two devotees Safto and Fato, took the idol away in a trunk and first took her to the town of Talauli near Ponda. Till today, the people of this village worship the sign of the feet of the goddess. The idol brought from Colva was then taken to Bandode and installed along with the existing idol.

So today there are two ","https://firebasestorage.googleapis.com/v0/b/sih2020-cad27.appspot.com/o/shree-mahalaxmi-temple.jpg?alt=media&token=1567fb08-6d0a-4ff6-b57d-c6ddda8f85ab","Ponda Taluk, Goa","Shree Mahalaxmi Temple","0","Temple","15.4034","74.0152","19"
"Located in Canacona in Southern Goa, Palolem Beach is one of the most beautiful beaches in Goa. Known for its picturesque natural beauty and uncanny party vibes, this semi-circular beach is only a mile long. Therefore, you will not require much time to explore all the beautiful sites that the beach has to offer. So, whether you are thinking about venturing out with a partner, or on your own, Palolem beach will always be enjoyable to you in every way. 

The northern side of the beach is known to be a little bit safer, as the tides are somewhat calmer in this area. Therefore, if you are travelling with a small family member, then it is recommended that you stay at this side of the beach. Nevertheless, if you have an unearthly thirst for adventure, then you should pay a visit to the southern part of the beach. In this section, the nature of the tides is more uncertain and precarious. Therefore, here, you can indulge in numerous types of water activities, such as kayaking and boat riding","https://firebasestorage.googleapis.com/v0/b/sih2020-cad27.appspot.com/o/palolem.jpg?alt=media&token=ac674d62-f6f2-49fe-b031-923948cbdcf5","Canacona,South Goa","Palolem Beach","0","Beach","15.01","74.0232","20"
"The capital of Goa, a small and charming city on the left bank of silvery Mandovi
river with beautiful, red-roofed houses, built in Latin style, also boasts of many modern
houses, well laid gardens, statues and avenues lined with Gulmohar, Acassia and other
trees. Enchanting panorama unfolds from atop Altinho (Hill Top).","https://firebasestorage.googleapis.com/v0/b/sih2020-cad27.appspot.com/o/panaji_gallery_2-1.jpg?alt=media&token=a4add0ad-942d-4b94-9b1e-06555de0fea1","North Goa","Panaji","0","Town","15.4909","73.8278","21"
"Margao: (33 km). The hinterland of Southern Goa in Salcete taluka is a thriving
commercial metropolis linked by rail to the rest of India & Mormugao Harbour and the
national highways, with Maharashtra and Karnataka. It has fine parks, gardens as well
as imposing old mansions and modern buildings.","https://firebasestorage.googleapis.com/v0/b/sih2020-cad27.appspot.com/o/margao.jpg?alt=media&token=6a3274b1-7e6e-43c1-8467-c4864f390ae6","South Goa","Margao","0","Town","15.2832","73.9862","22"
" A modern well laid out city close to Mormugao
Harbor. It has beautiful and extensive avenue and gardens. The air terminus of Goa at
""Dabolim"" lies on the outskirts of the city, is also the railway terminus for passenger
service.","https://firebasestorage.googleapis.com/v0/b/sih2020-cad27.appspot.com/o/vasco.jpg?alt=media&token=ae8276e6-9f53-4998-8807-9b348f578d65","Mormugao taluka","Vasco Da Gama","0","Town","15.3982","73.8113","23"
"Capital of Bardez Taluka is at the cross roads of the network of
highways covering whole northern Goa. It has beautiful layout with gardens and a church. Weekly Fair on Friday is held at the modern stream lined market and attended by large
crowds","https://firebasestorage.googleapis.com/v0/b/sih2020-cad27.appspot.com/o/mapusa.jpg?alt=media&token=ab998324-135f-498e-a3db-30f7de2a2c0a","Bardez Taluka","Mapusa","0","Town","15.5937","73.8142","24"
"Important religious and educational centre of Christian
Missionaries. The Church, Seminary and School atop hillock command a magnificent
panorama of the countryside around in view of Mormugao Harbor and Zuari River.","https://firebasestorage.googleapis.com/v0/b/sih2020-cad27.appspot.com/o/pilar.jpg?alt=media&token=7224bcd0-60cb-4ac5-b99d-f745a5146d43 ","Goa","Pilar","0","Town","15.4401","73.8934","25"
"The Church of Our Lady of the Rosary is a Catholic church built in 1544–1547, the oldest church still standing in Old Goa, State of Goa, India. This church is part of the collection belonging to the World Heritage Site of churches and convents of Goa.
According to the legend, a small chapel was built in honor Our Lady of the Rosary as per orders of Afonso de Albuquerque, after he had received the message that Goa was conquered in 1510 by the Portuguese. This small chapel is said to have been designed, according to Gaspar Correia, by master-builder Antão, Nogueira de Brito on the Monte Santo (Holy mountain) in Goa.","https://firebasestorage.googleapis.com/v0/b/sih2020-cad27.appspot.com/o/church_lady.jpg?alt=media&token=7b38b663-083b-4995-877d-f72e4b924bf8","Old Goa","Church of Our Lady Of Rosary","0","Church","15.5018","73.905","26"
"St. Cajetan Church, also known as the Church of Divine Providence, is a church of the Roman Catholic Archdiocese of Goa and Daman located in Old Goa. The church was completed in 1661 and is part of the World Heritage Site, Churches and convents of Goa.","https://firebasestorage.googleapis.com/v0/b/sih2020-cad27.appspot.com/o/cahetan.jpg?alt=media&token=3b6a0351-8165-47d4-9161-4daf4560258c","Panjim Old Goa","St Cajetan Church","0","Church","15.5056","73.915","27"
